<?xml version="1.0" encoding="UTF-8" ?> 
<ModelContentSelectionInf xmlns="http://sap.com/moin/MoinArchive" xmlns:xsi="http://www.w3.org/2001/XMLSchema-instance" xsi:schemaLocation="http://sap.com/moin/MoinArchive modelcontentselection_inf.xsd">
	<SupportedContentSelectionTypes>
		<ContentSelection type="DI" >
			<Property name="dcTypeName" value="com.sap.tc.moin.test.di.dctype.dummy.DummyTest" />
			<Property name="dcTypeVendor" value="test.sap.com" />
			<Property name="folder" value="src/models" /> 
			<Property name="folder" value="moin/models" />
			<Property name="folder" value="src/modeldata" /> 
		</ContentSelection >
		<ContentSelection type="DI" >
			<Property name="dcTypeName" value="com.sap.tc.moin.test.di.dctype.dummy.DummyTest" />
			<Property name="dcTypeVendor" value="test.sap.com" />
			<Property name="folder" value="src/mymodels" /> 
			<Property name="folder" value="moin/mymodels" /> 
		</ContentSelection >
		<ContentSelection type="DI" >
			<Property name="dcTypeName" value="com.sap.tc.moin.test.di.dctype.MoinTest" />
			<Property name="dcTypeVendor" value="test.sap.com" />
			<Property name="folder" value="src/addon/modeldata/" /> 			
		</ContentSelection >
	</SupportedContentSelectionTypes >
</ModelContentSelectionInf>
